{
  "result_id": "2026-08-15-alice-qwen3.8-27b-a1b2c3",
  "benchmark_type": "inference-speed",
  "model_family": "qwen3.8-27b",
  "contributor": "alice",
  "date": "2026-08-15",
  "tool": {
    "name": "llama-server + qwen3.8-27b/probe.py",
    "version": "b6500"
  },
  "protocol_version": "1.0",
  "variant": {
    "quantization": "UD-Q4_K_M",
    "repo_id": "unsloth/Qwen3.8-27B-GGUF",
    "file": "Qwen3.8-27B-UD-Q4_K_M.gguf"
  },
  "hardware": {
    "cpu": "AMD Ryzen 9 5900X",
    "gpu": "NVIDIA RTX 3090 (24 GB)",
    "ram_gb": 64,
    "vram_gb": 24,
    "os": "Ubuntu 24.04"
  },
  "settings": {
    "n_gpu_layers": 999,
    "context_length": 128000,
    "kv_cache_quant": "q4_0",
    "mtp_enabled": true,
    "spec_draft_n_max": 2,
    "flash_attn": 1,
    "prompt_tokens": 75000
  },
  "metrics": {
    "token_generation_tps": 24.6,
    "ttft_s": 74.3
  },
  "comment": "EXAMPLE ENTRY: replace every value with your own run before submitting.",
  "raw_output_file": "2026-08-15-alice-qwen3.8-27b-a1b2c3.raw.txt"
}
